{
  "schema_version": "account_orders_panel.v1",
  "workbench": "Account Workbench",
  "panel": "Account Orders Panel",
  "route": "/accounts/{account_id}/orders",
  "fixture_state": "blocked",
  "context": {
    "trading_day": "2026-06-14",
    "session_id": "account-workbench.fixture.20260614.003",
    "run_id": "account-orders.fixture.blocked.001",
    "reducer_checkpoint_id": "account-orders.checkpoint.blocked.001",
    "reducer_checkpoint_ts": "2026-06-14T14:31:38Z",
    "stream_state": "blocked",
    "projection_owner": "account-console-contracts",
    "source_authority": "typed_blocker"
  },
  "account": {
    "account_id": "acct.demo-19053",
    "account_alias": "19053",
    "account_kind": "real_feed_sandbox_paper"
  },
  "orders": [
    {
      "account_id": "acct.demo-19053",
      "client_order_id": "p077-e100-rb2610-closeyesterday",
      "instrument": "rb2610",
      "side": "SELL",
      "offset": "CLOSEYESTERDAY",
      "order_type": "LIMIT",
      "limit_price": 3158.0,
      "quantity": 1,
      "filled_quantity": 1,
      "remaining_quantity": 0,
      "status": "blocked",
      "lifecycle_ref": null,
      "report_provenance_ref": "D:/Nautilus/nautilus_ctp_adapter/output/reports/p077-paper-lifecycle/20260614T130516Z/p077_t6_e100_bounded_paper_close_yesterday_filled_reconciled.json",
      "source_ref": "fixture://account-workbench/orders/p077-e100-rb2610-closeyesterday/blocked-missing-lifecycle",
      "checksum": "sha256:3434343434343434343434343434343434343434343434343434343434343434"
    }
  ],
  "blockers": [
    {
      "blocker_id": "account-console.p004.phase3.order-lifecycle-ref-missing",
      "severity": "high",
      "kind": "missing_lifecycle_ref",
      "owner": "account-console-contracts",
      "next_action": "Provide an order detail fixture with official event sequence before UI implementation closeout.",
      "source_ref": "fixture://account-workbench/blockers/p004/phase3/order-lifecycle-ref-missing",
      "checksum": "sha256:4545454545454545454545454545454545454545454545454545454545454545"
    }
  ],
  "source_refs": [
    {
      "kind": "typed_blocker",
      "owner": "account-console-contracts",
      "source_ref": "fixture://account-workbench/blockers/p004/phase3/order-lifecycle-ref-missing",
      "checksum": "sha256:4545454545454545454545454545454545454545454545454545454545454545",
      "authority": "typed blocker fixture; not order truth"
    }
  ],
  "boundaries": {
    "read_only_projection": true,
    "runtime_truth": false,
    "account_truth": false,
    "order_truth": false,
    "ledger_truth": false,
    "ui_truth": false,
    "paper_ready": false,
    "live_ready": false,
    "broker_tradable": false,
    "admission_truth": false,
    "capital_truth": false,
    "action_controls": false
  },
  "rejection_rules": [
    "Reject blocked rows as filled lifecycle proof.",
    "Reject missing lifecycle_ref as acceptable implementation evidence."
  ]
}
