{
  "schema_version": "account_orders_panel.v1",
  "workbench": "Account Workbench",
  "panel": "Account Orders Panel",
  "route": "/accounts/{account_id}/orders",
  "fixture_state": "stale",
  "context": {
    "trading_day": "2026-06-14",
    "session_id": "account-workbench.fixture.20260614.003",
    "run_id": "account-orders.fixture.stale.001",
    "reducer_checkpoint_id": "account-orders.checkpoint.stale.001",
    "reducer_checkpoint_ts": "2026-06-14T14:31:38Z",
    "stream_state": "stale",
    "projection_owner": "account-console-contracts",
    "source_authority": "typed_blocker"
  },
  "account": {
    "account_id": "acct.demo-19053",
    "account_alias": "19053",
    "account_kind": "real_feed_sandbox_paper"
  },
  "orders": [],
  "blockers": [
    {
      "blocker_id": "account-console.p004.phase3.order-stream-stale",
      "severity": "warning",
      "kind": "stale_order_stream",
      "owner": "external strategy/runtime owner",
      "next_action": "Refresh normalized order read model or record owner blocker before rendering current order state.",
      "source_ref": "fixture://account-workbench/blockers/p004/phase3/order-stream-stale",
      "checksum": "sha256:5656565656565656565656565656565656565656565656565656565656565656"
    }
  ],
  "source_refs": [
    {
      "kind": "typed_blocker",
      "owner": "account-console-contracts",
      "source_ref": "fixture://account-workbench/blockers/p004/phase3/order-stream-stale",
      "checksum": "sha256:5656565656565656565656565656565656565656565656565656565656565656",
      "authority": "stale-state fixture only"
    }
  ],
  "boundaries": {
    "read_only_projection": true,
    "runtime_truth": false,
    "account_truth": false,
    "order_truth": false,
    "ledger_truth": false,
    "ui_truth": false,
    "paper_ready": false,
    "live_ready": false,
    "broker_tradable": false,
    "admission_truth": false,
    "capital_truth": false,
    "action_controls": false
  },
  "rejection_rules": [
    "Reject stale fixture as current order state.",
    "Reject stale fixture as permission to repair by calling broker/runtime."
  ]
}
